{
  "$schema": "http://json-schema.org/draft-07/schema#",
  "$id": "https://paygate-optimizer.com/schemas/provider-data.json",
  "title": "PayGate Optimizer - Provider Data Schema",
  "description": "Ø§Ù„Ù†Ù…ÙˆØ°Ø¬ Ø§Ù„Ù†Ù‡Ø§Ø¦ÙŠ Ù„Ø¨ÙŠØ§Ù†Ø§Øª Ø¨ÙˆØ§Ø¨Ø§Øª Ø§Ù„Ø¯ÙØ¹ Ø§Ù„Ù…Ø³ØªØ®Ø¯Ù…Ø© ÙÙŠ Ø§Ù„Ù…Ù‚Ø§Ø±Ù†Ø§Øª",
  "version": "1.0.0",
  "lastUpdated": "2025-12-09",
  "type": "object",
  "required": [
    "slug",
    "nameAr",
    "nameEn",
    "category",
    "status",
    "fees",
    "paymentMethods"
  ],
  "properties": {
    "_comment": {
      "type": "string",
      "description": "Ù…Ù„Ø§Ø­Ø¸Ø§Øª Ù„Ù„ØªÙˆØ«ÙŠÙ‚"
    },
    
    "slug": {
      "type": "string",
      "description": "Ø§Ù„Ù…Ø¹Ø±Ù Ø§Ù„ÙØ±ÙŠØ¯ Ù„Ù„Ø¨ÙˆØ§Ø¨Ø© (Ø¨Ø§Ù„Ø¥Ù†Ø¬Ù„ÙŠØ²ÙŠØ©ØŒ Ø¨Ø¯ÙˆÙ† Ù…Ø³Ø§ÙØ§Øª)",
      "pattern": "^[a-z0-9_-]+$",
      "examples": ["moyasar", "hyperpay", "tap"]
    },
    
    "nameAr": {
      "type": "string",
      "description": "Ø§Ø³Ù… Ø§Ù„Ø¨ÙˆØ§Ø¨Ø© Ø¨Ø§Ù„Ø¹Ø±Ø¨ÙŠØ©",
      "examples": ["Ù…ÙˆÙŠØ§Ø³Ø±", "Ù‡Ø§ÙŠØ¨Ø±Ø¨Ø§ÙŠ", "ØªØ§Ø¨ Ù„Ù„Ù…Ø¯ÙÙˆØ¹Ø§Øª"]
    },
    
    "nameEn": {
      "type": "string",
      "description": "Ø§Ø³Ù… Ø§Ù„Ø¨ÙˆØ§Ø¨Ø© Ø¨Ø§Ù„Ø¥Ù†Ø¬Ù„ÙŠØ²ÙŠØ©",
      "examples": ["Moyasar", "HyperPay", "Tap Payments"]
    },
    
    "websiteUrl": {
      "type": "string",
      "format": "uri",
      "description": "Ø§Ù„Ù…ÙˆÙ‚Ø¹ Ø§Ù„Ø±Ø³Ù…ÙŠ Ù„Ù„Ø¨ÙˆØ§Ø¨Ø©",
      "examples": ["https://moyasar.com"]
    },
    
    "pricingUrl": {
      "type": "string",
      "format": "uri",
      "description": "Ø±Ø§Ø¨Ø· ØµÙØ­Ø© Ø§Ù„Ø£Ø³Ø¹Ø§Ø± Ø§Ù„Ø±Ø³Ù…ÙŠØ© (Ù…Ù‡Ù… Ù„Ù„ØªÙˆØ«ÙŠÙ‚)"
    },
    
    "docsUrl": {
      "type": "string",
      "format": "uri",
      "description": "Ø±Ø§Ø¨Ø· Ø§Ù„ØªÙˆØ«ÙŠÙ‚ Ø§Ù„ØªÙ‚Ù†ÙŠ"
    },
    
    "category": {
      "type": "string",
      "enum": ["payment_gateway", "psp", "acquirer", "bnpl", "aggregator", "wallet"],
      "description": "ÙØ¦Ø© Ø§Ù„Ø¨ÙˆØ§Ø¨Ø©"
    },
    
    "status": {
      "type": "string",
      "enum": ["active", "limited", "paused", "deprecated"],
      "description": "Ø­Ø§Ù„Ø© Ø§Ù„Ø¨ÙˆØ§Ø¨Ø©"
    },
    
    "fees": {
      "type": "object",
      "description": "ğŸ”´ Ø§Ù„Ø±Ø³ÙˆÙ… - Ø§Ù„Ø£Ù‡Ù… ÙÙŠ Ø­Ø³Ø§Ø¨ Ø§Ù„ØªÙƒÙ„ÙØ© (30% Ù…Ù† Ø§Ù„ÙˆØ²Ù†)",
      "required": ["setupFee", "monthlyFee", "transactionFees"],
      "properties": {
        "setupFee": {
          "type": "number",
          "minimum": 0,
          "description": "Ø±Ø³ÙˆÙ… Ø§Ù„ØªØ³Ø¬ÙŠÙ„ Ù„Ù…Ø±Ø© ÙˆØ§Ø­Ø¯Ø© (Ø±.Ø³) - ØªØ¸Ù‡Ø± ÙƒÙ€ Caveat Ø¥Ø°Ø§ > 0",
          "examples": [0, 500, 1000]
        },
        "monthlyFee": {
          "type": "number",
          "minimum": 0,
          "description": "Ø§Ù„Ø±Ø³ÙˆÙ… Ø§Ù„Ø´Ù‡Ø±ÙŠØ© Ø§Ù„Ø«Ø§Ø¨ØªØ© (Ø±.Ø³) - ØªÙØ¶Ø§Ù Ù„Ù„ØªÙƒÙ„ÙØ© Ø§Ù„Ø¥Ø¬Ù…Ø§Ù„ÙŠØ©",
          "examples": [0, 99, 299]
        },
        "transactionFees": {
          "type": "object",
          "description": "Ø±Ø³ÙˆÙ… Ø§Ù„Ù…Ø¹Ø§Ù…Ù„Ø§Øª Ø­Ø³Ø¨ Ø·Ø±ÙŠÙ‚Ø© Ø§Ù„Ø¯ÙØ¹",
          "properties": {
            "mada": {
              "$ref": "#/definitions/transactionFee",
              "description": "Ø±Ø³ÙˆÙ… Ù…Ø¯Ù‰"
            },
            "visa": {
              "$ref": "#/definitions/transactionFee",
              "description": "Ø±Ø³ÙˆÙ… ÙÙŠØ²Ø§"
            },
            "mastercard": {
              "$ref": "#/definitions/transactionFee",
              "description": "Ø±Ø³ÙˆÙ… Ù…Ø§Ø³ØªØ±ÙƒØ§Ø±Ø¯"
            },
            "amex": {
              "$ref": "#/definitions/transactionFee",
              "description": "Ø±Ø³ÙˆÙ… Ø£Ù…Ø±ÙŠÙƒØ§Ù† Ø¥ÙƒØ³Ø¨Ø±ÙŠØ³"
            },
            "apple_pay": {
              "$ref": "#/definitions/transactionFee",
              "description": "Ø±Ø³ÙˆÙ… Apple Pay"
            },
            "google_pay": {
              "$ref": "#/definitions/transactionFee",
              "description": "Ø±Ø³ÙˆÙ… Google Pay"
            },
            "stc_pay": {
              "$ref": "#/definitions/transactionFee",
              "description": "Ø±Ø³ÙˆÙ… STC Pay"
            },
            "sadad": {
              "$ref": "#/definitions/transactionFee",
              "description": "Ø±Ø³ÙˆÙ… Ø³Ø¯Ø§Ø¯"
            },
            "tabby": {
              "$ref": "#/definitions/transactionFee",
              "description": "Ø±Ø³ÙˆÙ… ØªØ§Ø¨ÙŠ BNPL"
            },
            "tamara": {
              "$ref": "#/definitions/transactionFee",
              "description": "Ø±Ø³ÙˆÙ… ØªÙ…Ø§Ø±Ø§ BNPL"
            }
          }
        },
        "refundFee": {
          "type": "number",
          "minimum": 0,
          "description": "Ø±Ø³ÙˆÙ… Ø§Ù„Ø§Ø³ØªØ±Ø¯Ø§Ø¯ (Ø±.Ø³ Ù„ÙƒÙ„ Ø¹Ù…Ù„ÙŠØ©)"
        },
        "chargebackFee": {
          "type": "number",
          "minimum": 0,
          "description": "Ø±Ø³ÙˆÙ… Chargeback (Ø±.Ø³ Ù„ÙƒÙ„ Ø­Ø§Ù„Ø©)"
        }
      }
    },
    
    "paymentMethods": {
      "type": "object",
      "description": "ğŸŸ¡ Ø·Ø±Ù‚ Ø§Ù„Ø¯ÙØ¹ Ø§Ù„Ù…Ø¯Ø¹ÙˆÙ…Ø© - ØªØ¤Ø«Ø± Ø¹Ù„Ù‰ Fit Score (20% Ù…Ù† Ø§Ù„ÙˆØ²Ù†)",
      "properties": {
        "mada": { "$ref": "#/definitions/paymentMethodSupport" },
        "visa": { "$ref": "#/definitions/paymentMethodSupport" },
        "mastercard": { "$ref": "#/definitions/paymentMethodSupport" },
        "amex": { "$ref": "#/definitions/paymentMethodSupport" },
        "apple_pay": { "$ref": "#/definitions/paymentMethodSupport" },
        "google_pay": { "$ref": "#/definitions/paymentMethodSupport" },
        "stc_pay": { "$ref": "#/definitions/paymentMethodSupport" },
        "sadad": { "$ref": "#/definitions/paymentMethodSupport" },
        "bank_transfer": { "$ref": "#/definitions/paymentMethodSupport" },
        "tabby": { "$ref": "#/definitions/paymentMethodSupport" },
        "tamara": { "$ref": "#/definitions/paymentMethodSupport" }
      }
    },
    
    "operations": {
      "type": "object",
      "description": "Ø¨ÙŠØ§Ù†Ø§Øª Ø§Ù„Ø¹Ù…Ù„ÙŠØ§Øª",
      "properties": {
        "activationDaysMin": {
          "type": "integer",
          "minimum": 0,
          "description": "Ø£Ù‚Ù„ ÙˆÙ‚Øª Ù„Ù„ØªÙØ¹ÙŠÙ„ (Ø¨Ø§Ù„Ø£ÙŠØ§Ù…)"
        },
        "activationDaysMax": {
          "type": "integer",
          "minimum": 0,
          "description": "Ø£Ù‚ØµÙ‰ ÙˆÙ‚Øª Ù„Ù„ØªÙØ¹ÙŠÙ„ (Ø¨Ø§Ù„Ø£ÙŠØ§Ù…)"
        },
        "settlementDaysMin": {
          "type": "integer",
          "minimum": 0,
          "description": "Ø£Ù‚Ù„ ÙˆÙ‚Øª Ù„Ù„ØªØ³ÙˆÙŠØ© (Ø¨Ø§Ù„Ø£ÙŠØ§Ù…)"
        },
        "settlementDaysMax": {
          "type": "integer",
          "minimum": 0,
          "description": "Ø£Ù‚ØµÙ‰ ÙˆÙ‚Øª Ù„Ù„ØªØ³ÙˆÙŠØ© (Ø¨Ø§Ù„Ø£ÙŠØ§Ù…)"
        },
        "payoutSchedule": {
          "type": "string",
          "enum": ["daily", "weekly", "biweekly", "monthly"],
          "description": "Ø¬Ø¯ÙˆÙ„ Ø§Ù„Ø¯ÙØ¹"
        },
        "payoutMinAmount": {
          "type": "number",
          "minimum": 0,
          "description": "Ø§Ù„Ø­Ø¯ Ø§Ù„Ø£Ø¯Ù†Ù‰ Ù„Ù„Ø³Ø­Ø¨ (Ø±.Ø³)"
        }
      }
    },
    
    "support": {
      "type": "object",
      "description": "Ø¨ÙŠØ§Ù†Ø§Øª Ø§Ù„Ø¯Ø¹Ù… Ø§Ù„ÙÙ†ÙŠ",
      "properties": {
        "channels": {
          "type": "array",
          "items": {
            "type": "string",
            "enum": ["email", "phone", "chat", "whatsapp", "ticket"]
          },
          "description": "Ù‚Ù†ÙˆØ§Øª Ø§Ù„Ø¯Ø¹Ù… Ø§Ù„Ù…ØªØ§Ø­Ø©"
        },
        "hours": {
          "type": "string",
          "description": "Ø³Ø§Ø¹Ø§Øª Ø§Ù„Ø¯Ø¹Ù…",
          "examples": ["9AM-6PM Sun-Thu", "24/7"]
        },
        "languages": {
          "type": "array",
          "items": { "type": "string" },
          "description": "Ø§Ù„Ù„ØºØ§Øª Ø§Ù„Ù…Ø¯Ø¹ÙˆÙ…Ø© ÙÙŠ Ø§Ù„Ø¯Ø¹Ù…",
          "examples": [["ar", "en"]]
        }
      }
    },
    
    "opsScores": {
      "type": "object",
      "description": "ğŸŸ¢ ØªÙ‚ÙŠÙŠÙ…Ø§Øª Ø§Ù„Ø£Ø¯Ø§Ø¡ - ØªØ¤Ø«Ø± Ø¹Ù„Ù‰ Ops Score (15% Ù…Ù† Ø§Ù„ÙˆØ²Ù†)",
      "properties": {
        "onboardingScore": {
          "type": "integer",
          "minimum": 0,
          "maximum": 100,
          "description": "ØªÙ‚ÙŠÙŠÙ… Ø³Ù‡ÙˆÙ„Ø© Ø§Ù„ØªÙØ¹ÙŠÙ„ (0-100)"
        },
        "supportScore": {
          "type": "integer",
          "minimum": 0,
          "maximum": 100,
          "description": "ØªÙ‚ÙŠÙŠÙ… Ø¬ÙˆØ¯Ø© Ø§Ù„Ø¯Ø¹Ù… Ø§Ù„ÙÙ†ÙŠ (0-100)"
        },
        "docsScore": {
          "type": "integer",
          "minimum": 0,
          "maximum": 100,
          "description": "ØªÙ‚ÙŠÙŠÙ… Ø¬ÙˆØ¯Ø© Ø§Ù„ØªÙˆØ«ÙŠÙ‚ (0-100)"
        }
      }
    },
    
    "rating": {
      "type": "object",
      "description": "ğŸŸ£ ØªÙ‚ÙŠÙŠÙ…Ø§Øª Ø§Ù„Ù…Ø³ØªØ®Ø¯Ù…ÙŠÙ† - ØªØ¤Ø«Ø± Ø¹Ù„Ù‰ Rating Score (10% Ù…Ù† Ø§Ù„ÙˆØ²Ù†)",
      "properties": {
        "average": {
          "type": "number",
          "minimum": 0,
          "maximum": 5,
          "description": "Ù…ØªÙˆØ³Ø· Ø§Ù„ØªÙ‚ÙŠÙŠÙ… (1-5 Ù†Ø¬ÙˆÙ…)"
        },
        "count": {
          "type": "integer",
          "minimum": 0,
          "description": "Ø¹Ø¯Ø¯ Ø§Ù„ØªÙ‚ÙŠÙŠÙ…Ø§Øª"
        },
        "source": {
          "type": "string",
          "description": "Ù…ØµØ¯Ø± Ø§Ù„ØªÙ‚ÙŠÙŠÙ…Ø§Øª",
          "examples": ["Google Reviews", "Internal", "Trustpilot"]
        }
      }
    },
    
    "capabilities": {
      "type": "array",
      "description": "Ø§Ù„Ù‚Ø¯Ø±Ø§Øª ÙˆØ§Ù„Ù…ÙŠØ²Ø§Øª Ø§Ù„Ù…Ø¯Ø¹ÙˆÙ…Ø© - ØªØ¤Ø«Ø± Ø¹Ù„Ù‰ Fit Score",
      "items": {
        "type": "string",
        "enum": [
          "recurring",
          "tokenization",
          "multi_currency",
          "fast_settlement",
          "plugins_shopify",
          "plugins_woocommerce",
          "plugins_salla",
          "plugins_zid",
          "mobile_sdk",
          "invoicing",
          "payment_links"
        ]
      }
    },
    
    "sectors": {
      "type": "object",
      "description": "Ø¯Ø¹Ù… Ø§Ù„Ù‚Ø·Ø§Ø¹Ø§Øª - ÙŠØ¤Ø«Ø± Ø¹Ù„Ù‰ Fit Score + Reasons",
      "additionalProperties": {
        "type": "string",
        "enum": ["supported", "restricted", "not_supported"]
      },
      "examples": [{
        "ecommerce": "supported",
        "restaurants": "supported",
        "gaming": "restricted",
        "gambling": "not_supported"
      }]
    },
    
    "integrations": {
      "type": "array",
      "description": "Ø§Ù„ØªÙƒØ§Ù…Ù„Ø§Øª Ù…Ø¹ Ø§Ù„Ù…Ù†ØµØ§Øª",
      "items": {
        "type": "object",
        "required": ["platform", "isAvailable"],
        "properties": {
          "platform": {
            "type": "string",
            "enum": ["shopify", "woocommerce", "magento", "salla", "zid", "opencart", "prestashop", "custom_api", "mobile_sdk"]
          },
          "isAvailable": { "type": "boolean" },
          "isOfficial": { "type": "boolean" },
          "pluginUrl": { "type": "string", "format": "uri" },
          "setupDifficulty": {
            "type": "string",
            "enum": ["easy", "medium", "hard"]
          }
        }
      }
    },
    
    "prosAr": {
      "type": "array",
      "items": { "type": "string" },
      "description": "Ø§Ù„Ù…Ù…ÙŠØ²Ø§Øª Ø¨Ø§Ù„Ø¹Ø±Ø¨ÙŠØ©"
    },
    
    "prosEn": {
      "type": "array",
      "items": { "type": "string" },
      "description": "Ø§Ù„Ù…Ù…ÙŠØ²Ø§Øª Ø¨Ø§Ù„Ø¥Ù†Ø¬Ù„ÙŠØ²ÙŠØ©"
    },
    
    "consAr": {
      "type": "array",
      "items": { "type": "string" },
      "description": "Ø§Ù„Ø¹ÙŠÙˆØ¨ Ø¨Ø§Ù„Ø¹Ø±Ø¨ÙŠØ©"
    },
    
    "consEn": {
      "type": "array",
      "items": { "type": "string" },
      "description": "Ø§Ù„Ø¹ÙŠÙˆØ¨ Ø¨Ø§Ù„Ø¥Ù†Ø¬Ù„ÙŠØ²ÙŠØ©"
    },
    
    "dataSource": {
      "type": "object",
      "description": "Ù…ØµØ§Ø¯Ø± Ø§Ù„Ø¨ÙŠØ§Ù†Ø§Øª Ù„Ù„ØªÙˆØ«ÙŠÙ‚",
      "properties": {
        "pricingUrl": { "type": "string", "format": "uri" },
        "lastVerified": { "type": "string", "format": "date" },
        "notes": { "type": "string" }
      }
    }
  },
  
  "definitions": {
    "transactionFee": {
      "type": "object",
      "description": "Ø±Ø³ÙˆÙ… Ø§Ù„Ù…Ø¹Ø§Ù…Ù„Ø© Ù„Ø·Ø±ÙŠÙ‚Ø© Ø¯ÙØ¹ Ù…Ø¹ÙŠÙ†Ø©",
      "properties": {
        "percent": {
          "type": "number",
          "minimum": 0,
          "maximum": 100,
          "description": "Ø§Ù„Ù†Ø³Ø¨Ø© Ø§Ù„Ù…Ø¦ÙˆÙŠØ© Ù…Ù† Ù‚ÙŠÙ…Ø© Ø§Ù„Ù…Ø¹Ø§Ù…Ù„Ø©"
        },
        "fixed": {
          "type": "number",
          "minimum": 0,
          "description": "Ø§Ù„Ø±Ø³ÙˆÙ… Ø§Ù„Ø«Ø§Ø¨ØªØ© Ø¨Ø§Ù„Ø±ÙŠØ§Ù„ Ù„ÙƒÙ„ Ù…Ø¹Ø§Ù…Ù„Ø©"
        },
        "notes": {
          "type": "string",
          "description": "Ù…Ù„Ø§Ø­Ø¸Ø§Øª Ø¥Ø¶Ø§ÙÙŠØ©"
        }
      },
      "required": ["percent", "fixed"]
    },
    
    "paymentMethodSupport": {
      "type": "object",
      "properties": {
        "isSupported": {
          "type": "boolean",
          "description": "Ù‡Ù„ Ø·Ø±ÙŠÙ‚Ø© Ø§Ù„Ø¯ÙØ¹ Ù…Ø¯Ø¹ÙˆÙ…Ø©ØŸ"
        },
        "supportsRecurring": {
          "type": "boolean",
          "description": "Ù‡Ù„ ÙŠØ¯Ø¹Ù… Ø§Ù„Ø§Ø´ØªØ±Ø§ÙƒØ§Øª Ø§Ù„Ù…ØªÙƒØ±Ø±Ø©ØŸ"
        }
      },
      "required": ["isSupported"]
    }
  }
}
